{
  "schema_version": "devseek.capability-ledger/v1",
  "integrity": {
    "hash_algorithm": "sha256",
    "canonicalization_version": "devseek-canonical-json/v1"
  },
  "ledger_id": "DEVSEEK-CAPABILITY-LEDGER/v1",
  "qualification_claim_policy": {
    "mode": "deny-until-signed-evidence-validator",
    "profile_registry_sha256": null,
    "evidence_registry_sha256": null
  },
  "classification_rules": [
    {
      "rule_id": "c0-qualification-infrastructure",
      "specificity": 10,
      "selector": {
        "domains": [
          "C0"
        ]
      },
      "priority": "P0",
      "applicability": {
        "state": "active",
        "claim_scopes": [
          "qualification-infrastructure"
        ],
        "not_applicable_requires_adjudication": true
      }
    },
    {
      "rule_id": "core-coding-p0",
      "specificity": 10,
      "selector": {
        "domains": [
          "C1",
          "C2",
          "C6",
          "C7",
          "C8",
          "C9"
        ]
      },
      "priority": "P0",
      "applicability": {
        "state": "active",
        "claim_scopes": [
          "core-coding"
        ],
        "not_applicable_requires_adjudication": true
      }
    },
    {
      "rule_id": "core-coding-p1",
      "specificity": 10,
      "selector": {
        "domains": [
          "C3",
          "C4",
          "C5",
          "C10",
          "C11",
          "C12"
        ]
      },
      "priority": "P1",
      "applicability": {
        "state": "active",
        "claim_scopes": [
          "core-coding"
        ],
        "not_applicable_requires_adjudication": true
      }
    },
    {
      "rule_id": "extension-default",
      "specificity": 10,
      "selector": {
        "domains": [
          "C13"
        ]
      },
      "priority": "P2",
      "applicability": {
        "state": "conditional",
        "claim_scopes": [
          "orchestration-capable",
          "extension-capable"
        ],
        "not_applicable_requires_adjudication": true
      }
    },
    {
      "rule_id": "qualification-aggregate",
      "specificity": 10,
      "selector": {
        "domains": [
          "C14"
        ]
      },
      "priority": "P0",
      "applicability": {
        "state": "conditional",
        "claim_scopes": [
          "qualification-aggregate"
        ],
        "not_applicable_requires_adjudication": true
      }
    },
    {
      "rule_id": "safety-boundary-override",
      "specificity": 100,
      "selector": {
        "capability_ids": [
          "C4-EXTERNAL-BOUNDARY",
          "C10-INDEPENDENT-REVIEW",
          "C10-DELIVERY-MANIFEST",
          "C10-ARTIFACT-IDENTITY",
          "C12-RUN-EVIDENCE-RETENTION"
        ]
      },
      "priority": "P0",
      "applicability": {
        "state": "active",
        "claim_scopes": [
          "core-coding",
          "safety"
        ],
        "not_applicable_requires_adjudication": true
      }
    },
    {
      "rule_id": "visual-computer-use-override",
      "specificity": 100,
      "selector": {
        "capability_ids": [
          "C6-VISUAL-COMPUTER-USE"
        ]
      },
      "priority": "P2",
      "applicability": {
        "state": "conditional",
        "claim_scopes": [
          "visual-computer-use"
        ],
        "not_applicable_requires_adjudication": true
      }
    },
    {
      "rule_id": "release-capable-override",
      "specificity": 100,
      "selector": {
        "capability_ids": [
          "C10-GIT-DELIVERY",
          "C10-RELEASE-GATE",
          "C10-CI-DEPLOY-OBSERVE",
          "C10-ROLLBACK"
        ]
      },
      "priority": "P2",
      "applicability": {
        "state": "conditional",
        "claim_scopes": [
          "release-capable"
        ],
        "not_applicable_requires_adjudication": true
      }
    },
    {
      "rule_id": "background-automation-override",
      "specificity": 100,
      "selector": {
        "capability_ids": [
          "C11-BACKGROUND-AUTOMATION"
        ]
      },
      "priority": "P2",
      "applicability": {
        "state": "deferred",
        "claim_scopes": [
          "background-automation"
        ],
        "not_applicable_requires_adjudication": true
      }
    },
    {
      "rule_id": "mcp-safety-override",
      "specificity": 100,
      "selector": {
        "capability_ids": [
          "C13-MCP-BOUNDARY"
        ]
      },
      "priority": "P0",
      "applicability": {
        "state": "active",
        "claim_scopes": [
          "mcp-exposed-safety-boundary"
        ],
        "not_applicable_requires_adjudication": true
      }
    },
    {
      "rule_id": "peer-agent-experimental-override",
      "specificity": 100,
      "selector": {
        "capability_ids": [
          "C13-PEER-AGENT-COORDINATION"
        ]
      },
      "priority": "P2",
      "applicability": {
        "state": "experimental",
        "claim_scopes": [
          "peer-agent"
        ],
        "not_applicable_requires_adjudication": true
      }
    }
  ],
  "capabilities": [
    {
      "capability_id": "C0-CAPABILITY-LEDGER-SCHEMA",
      "domain": "C0",
      "title": "C0 可证地基 / CapabilityLedgerSchema",
      "priority": "P0",
      "applicability": {
        "state": "active",
        "claim_scopes": [
          "qualification-infrastructure"
        ],
        "not_applicable_requires_adjudication": true
      },
      "semantic_authority": {
        "key": "c0-capability-ledger-schema",
        "port": "CapabilityLedgerSchema",
        "contract": {
          "schema_version": "devseek.authority-contract/v1",
          "contract_id": "C0-CAPABILITY-LEDGER-SCHEMA/v1",
          "decision_scope": "Own the semantic decision boundary for C0-CAPABILITY-LEDGER-SCHEMA.",
          "failure_semantics": "Fail closed when the authority is unavailable or returns an invalid decision.",
          "source_ref": "docs/top-agent-convergence-audit-20260711/06-能力追踪与文档治理方案.md#C0-CAPABILITY-LEDGER-SCHEMA"
        },
        "contract_sha256": "8d68ea6eb2dcf0cdfcda59cc5872448f7f9aaf29da339f5874fded0294fad9d5"
      },
      "implementation_state": "wired",
      "qualification_claims": [],
      "qualification_level_view": null,
      "implementation_components": [
        {
          "role": "schema",
          "path": "docs/process/devseek-capability-ledger.schema.json"
        },
        {
          "role": "milestone-profile-schema",
          "path": "docs/process/devseek-milestone-profiles.schema.json"
        },
        {
          "role": "work-manifest-schema",
          "path": "docs/process/devseek-capability-work-manifest.schema.json"
        },
        {
          "role": "source-of-truth",
          "path": "docs/process/devseek-capability-ledger.json"
        },
        {
          "role": "milestone-profile-source",
          "path": "docs/process/devseek-milestone-profiles.json"
        },
        {
          "role": "semantic-validator-and-generator",
          "path": "scripts/lib/devseek-capability-ledger.mjs"
        },
        {
          "role": "gate-cli",
          "path": "scripts/devseek-capability-ledger-check.mjs"
        },
        {
          "role": "contract-tests",
          "path": "scripts/test/devseek-capability-ledger.test.mjs"
        },
        {
          "role": "c0-ledger-wiring-source",
          "path": "docs/process/devseek-c0-ledger-wiring.json"
        },
        {
          "role": "c0-ledger-wiring-schema",
          "path": "docs/process/devseek-c0-ledger-wiring.schema.json"
        },
        {
          "role": "c0-ledger-wiring-generated-view",
          "path": "docs/process/generated/devseek-c0-ledger-wiring.md"
        },
        {
          "role": "c0-ledger-wiring-checker",
          "path": "scripts/devseek-c0-ledger-wiring-check.mjs"
        },
        {
          "role": "c0-ledger-wiring-library",
          "path": "scripts/lib/devseek-c0-ledger-wiring.mjs"
        },
        {
          "role": "c0-ledger-wiring-contract-tests",
          "path": "scripts/test/devseek-c0-ledger-wiring.test.mjs"
        },
        {
          "role": "external-authority-adapter-source",
          "path": "docs/process/devseek-external-authority-adapter.json"
        },
        {
          "role": "external-authority-adapter-schema",
          "path": "docs/process/devseek-external-authority-adapter.schema.json"
        },
        {
          "role": "external-authority-attestation-schema",
          "path": "docs/process/devseek-external-authority-attestation.schema.json"
        },
        {
          "role": "external-authority-adapter-generated-view",
          "path": "docs/process/generated/devseek-external-authority-adapter.md"
        },
        {
          "role": "external-authority-adapter-checker",
          "path": "scripts/devseek-external-authority-adapter-check.mjs"
        },
        {
          "role": "external-authority-adapter-library",
          "path": "scripts/lib/devseek-external-authority-adapter.mjs"
        },
        {
          "role": "external-authority-adapter-contract-tests",
          "path": "scripts/test/devseek-external-authority-adapter.test.mjs"
        }
      ],
      "architecture_dependencies": [],
      "verification": {
        "commands": [
          "npm run verify:capability-ledger",
          "npm run verify:c0-ledger-wiring",
          "npm run verify:external-authority-adapter"
        ],
        "evidence_kind": "deterministic-regression"
      }
    },
    {
      "capability_id": "C0-RUN-EVIDENCE-LEDGER",
      "domain": "C0",
      "title": "C0 可证地基 / RunEvidenceLedgerPort",
      "priority": "P0",
      "applicability": {
        "state": "active",
        "claim_scopes": [
          "qualification-infrastructure"
        ],
        "not_applicable_requires_adjudication": true
      },
      "semantic_authority": {
        "key": "c0-run-evidence-ledger",
        "port": "RunEvidenceLedgerPort",
        "contract": {